note,lang
"Apple blossom, golden syrup, passion fruit, strawberry, & juicy Producer: Felipe Ospina Varietal: Wush Wush Process: Champagne Natural Relationship Since: 2017 Recipes: Espresso: 1:2",en
"Juicy yellow peach, coconut, jasmine, blood orange, & velvety Producer: Felepe Henao Triana Varietal: Chiroso Process: Waahed Relationship Since: 2020 Recipes: Espresso: 1:2",en
"Apricot, peach, vanilla, white florals, & syrupy Producer: Juana Gallardo Varietal: Colombia Process: Honey Relationship Since: 2019 Recipes: Esp resso: 1:2",en
"Milk chocolate, cherry, rum, & violet Farm: El Líbano Varietal: San Bernardo Process: Anaerobic Natural Relationship Since: 2021 Recipes: Espresso: 1:2",en
"Cognac, vanilla, pecan, berries, & silky Producer: Felipe Ospina Varietal: Wush Wush Process: Dynamic Washed Relationship Since: 2017 Recipes: Espresso: 1:2",en
"﻿Floral, jasmine, cherry, vanilla, fudge, & apricot Producer: Javier & Nahun Fernandez Varietal: Geisha Process: Washed Relationship Since: 2012 Recipes: Espresso: 1:2",en
"Tangerine, jasmine, & lemon Farm: Finca Hartmann Producer: Hartmann Family Varietal: Heirloom Process: Honey Relationship Since: 2011 About: A real treasure has landed in the Panamanian jungle",en
"Brown sugar, jasmine, melon, berries, & syrupy About: ﻿This is a really good Ethiopian Coffee",en
"Strawberry, guava, passionfruit, vanilla, & creamy Producer: Sandra & Fernando Giron About: The horses knew the way home and needed little direction from us",en
"Juicy red apple, stewed peaches, & honey Producer: Ana Cecilia Velloso Varietal: Arara Process: Natural Relationship Since: 2018 Recipes: Espresso: 1:2",en
"Raspberry, blackberry, mango, milk chocolate, & syrupy",en
"Raspberry, blackberry, mango, milk chocolate, & syrupy Producer: Nancy & Oscar Maca Varietal: Wush Wush Process: Anaerobic Natural Relationship Since: 2017 Recipes: Espresso: 1:2",en
"Milk chocolate, strawberry, white grape, & creamy Producer: Muraho Trading Co",en
"Tasting Notes: Milk chocolate, strawberry, white grape, & creamy Producer: Muraho Trading Co",en
"Cherry, Apricot and blackberry Producer: Wilford Lamastus Region: Boquete Varietal: Catuai Process: Natural Recipes: Espresso: 1:2",en
"Milk chocolate, caramel, plum, & jammy Farm: Don Andres Varietal: Bourbon Process: Natural Relationship Since: 2012 Recipes: Espresso: 1:2",en
"milk chocolate, caramel, and plum",en
"Sweet and jammy with notes of milk chocolate, caramel, and plum",en
"Kiwi-fruit, guava, lychee & cherry bomb Farm: Finca Los Primos Varietal: Pacas Process: Natural Relationship Since: 2014 Recipes: Espresso: 1:2",en
"Brown sugar, sweet almond, lime, floral, & syrupy Producer: Boyce Harries Farm: Chania Estate Varietal: Mixed Process: Honey Relationship Since: 2019 Recipes: Espresso: 1:2",en
"Dark chocolate, cherry, vanilla, & syrupy Farm: Don Andres Varietal: Pacas & Catuai Process: Natural Recipes: Espresso: 1:2",en
"Purple grape, strawberry, & spice Washing Station: Kokosa, Moplaco Region: Sidamo Varietal: Heirloom Process: Kenya Process Relationship Since: 2020 Recipes: Espresso: 1:2",en
"Purple grape, champagne, & crisp Washing Station: Moplaco Bensa Region: Sidamo Varietal: Heirloom Process: Washed Relationship Since: 2020 Recipes: Espresso: 1:2",en
"Cacao nibs, wild berries, lavender, & syrupy Region: Don Andres Varietal: Parainema Process: Anaerobic Natural 60hrs Recipes: Espresso: 1:2",en
"Goosebumps, exploding heart, triple back flip, levitation, & dizzy Producer: Primrose Varietal: Heirloom Process: Supernatural Relationship Since: 2019 Recipes: Espresso: 1:2",en
"Strawberry jam, maple syrup & Turkish delight Continents: Africa & Central America Varietals: Mixed Process: Natural & Washed Recipes: ﻿Filter/Drip: 1:17   |   Espresso: 1:2",en
"5 Sweet, syrupy and lush",en
"Yellow peach, nectarine, floral, & juicy Region: Don Andres Varietal: Pacas Process: Washed Relationship Since: 2012 Recipes: Espresso: 1:2",en
yellow stone fruits like peach and nectarine,en
"Cherry, apricot, blackberry & syrupy Varietal: Catuai Process: Anaerobic Natural Relationship Since: 2016 Recipes: Espresso: 1:2",en
"Chocolate, plum, maple syrup, & red grape Region: El Brujo Varietal: Pacas Process: Natural Relationship Since: 2017 Recipes: Espresso: 1:2",en
"Milk chocolate, caramel, vanilla, & cherry Producer: José Wagner Varietal: Yellow Catuai Process: Natural Relationship Since: 2011 Recipes: Espresso: 1:2",en
"Milk chocolate, vanilla, peach, clean, & silky Producer: Mariana Junqueira Varietal: Yellow Bourbon Process: Natural Relationship Since: 2020 Recipes: Espresso: 1:2",en
"Chocolate, grape, black cherry, & plum Region: Las Flores Varietal: Pacas & Catuai Process: Anaerobic Natural 60hrs Recipes: Espresso: 1:2",en
"Apricot, blackberry, green apple, & sparkling Region: Santa Barbara Varietal: Catuai Process: Washed Recipes: Espresso: 1:2",en
"Brown sugar, orange, apricot, & juicy Producer: Hartmann Family Region: Santa Clara Varietal: Maragogipe Process: Honey Recipes: Espresso: 1:2",en
"Pineapple, blackberry, orange, chocolate, floral, & syrupy Producer: Hartmann Family Region: Santa Clara Varietal: Yellow Maragogipe Process: Natural Recipes: Espresso: 1:2",en
"Brown sugar, blackberry, citrus, & juicy Producer: Hartmann Family Region: Santa Clara Varietal: Yellow Maragogipe Process: Washed Recipes: Espresso: 1:2",en
"Chocolate, passion fruit, guava, & syrupy Region: Santa Clara Varietal: Caturra & Catuai Process: Natural Relationship Since: 2011 Recipes: Espresso: 1:2",en
"Red plum, apricot, brown sugar & silky body Region: Cerrado Mineiro Process: Pulp Natural About the farm: São Luiz Estate is a coffee farm that's both steeped in history, and embraces modernity; with",en
"Sweet, blanaced, dark chocolate, & malt finish Region: Nyabihu Varietal: Bourbon Process: Washed Recipes: Espresso: 1:2",en
"Juicy, tropical fruit, whiskey About: The Ixhuatlán region is home to some of the most desirable coffees in Mexico, due to the microclimate and its people, who have a deep commitment to the production",en
a fine whiskey,en
"﻿ Papaya, tropical, raw honey, rich heavy & creamy body Region: Santa Clara Varietals: Maragogype ﻿Processing: Natural",en
"Cherry, brown sugar, syrupy, & melon Producer: Aliss & Ratibor Hartmann Region: Santa Clara Varietal: Catuai & Caturra Process: Natural Relationship Since: 2011 Recipes: Espresso: 1:2",en
"Cherry, apricot, blackberry & juicy Farm: ﻿Elida Estate Region: Boquete, Los Naranjos Varietal: Cataui (red and yellow) Process: Natural Recipes: Espresso: 1:2",en
"Mango, pineapple, mandarin, syrupy & jasmine About: The Zuto is an absolute baller coffee, it is complex, exotic and tropical! Like a mysterious blanket, the mist hangs over the Geisha growing on Ojo",en
"﻿Jasmine, coffee flower, nectarine & apple About: The intensified aroma of jasmine, bergamont, and apricot was mind blowing! For a washed coffee, we knew this one was special",en
"﻿Papaya, cherry, mango & tropical fruit About: Luito",en
"pineapple, cherry and melon all fused together",en
"Tropical notes of pineapple, cherry and melon all fused together",en
"Chocolate fudge, orange, peach, & honey Region: Santa Clara Varietals: Caturra & Catuai ﻿Processing: Natural ﻿Coffee is left to dry in its whole fruit form which creates greater sweetness and a syrupy",en
"Sweet, blanaced, dark chocolate & malt finish Region: Nyabihu Varietal: Bourbon Process: Washed About: Vunga is a well-known washing station in Rwanda, and has a reputation for producing extremely hig",en
Producer:,en
"Brown sugar, vanilla, apricot, & syrupy Producer: Nahun Fernandez Region: Las Flores Varietal: Pacas Process: Anaerobic Washed Relationship: Since 2012 Recipe: Espresso - 1:2",en
"Strawberry jam, candied watermelon, syrupy and creamy This coffee has a roast profile that is great for drip coffee, french press, V60 and is well suited to milk or cream or black",en
﻿,en
"﻿ ﻿Lime, green apple, milk chocolate and vibrant The Story Behind the Bean: Parainema",en
Producer:,en
"Apricot, vanilla, apple, florals, & syrupy Producer: Manuel Vallecillo Farm: Los Primos Varietal: Pacas Process: Anaerobic Honey Relationship: Since 2014 Recipe: Espresso - 1:2",en
Producer:,en
"Chocolate, vanilla, red apple, & syrupy Producer: Manuel Vallecillo Region: El Cielito Varietal: Pacas Process: Natural Relationship: Since 2014 Recipe: Espresso - 1:2",en
"Iris, vanilla, cocoa, & syrupy Region: Las Flores Varietal: Pacas & Catuai Process: Natural Recipes: Espresso: 1:2",en
"Dark chocolate, cherry, vanilla, & syrupy Region: Las Flores Varietal: Pacas & Catuai Process: Natural Recipes: Espresso: 1:2",en
"Nahun’s natural Pacas & Catuai is sweet, juicy, and clean",en
"Florals, peach, & blackbery Region: Cuchumatan, Huehuetenango Producer: Todos Santos Co-op Certification: Organic Varietal: Pacamara Process: Washed Recipes: Espresso: 1:2",en
"Jasmine, apple, grapefruit, & vanilla Region: San Cristobal Verapaz Farm: Finca Santa Isabel Relationship: Since 2016 Varietal: Sarchimor Process: Washed Recipes: Espresso: 1:2",en
"The result of all this is a clean and crisp coffee, with distinct floral notes, particularly of jasmine",en
"Apple, brown sugar, & vanilla Region: Antigua ﻿Farm: ﻿La Esperanza ﻿Relationship: ﻿Since 2016 Varietal: Villa Sarchi Process: Washed Recipes: Espresso: 1:2",en
"White grapes, honey, rose, red fruit, lychee, plum Process: Honey Producer: Nahun Fernandez District: Las Flores, Santa Barbara Varietal: Parainema We are leading in to our seventh year in the mighty",en
"Orange zest, chocolate, almonds, strawberries & cream Process: Washed Varietals: Bourbon, Caturra & Catuai Region: San Jose Poaquil Recipe: Espresso: 1:2",en
"Red apple, honey, orange, juicy, creamy & molasses Awards: 3rd Place - Honduras COE 2018 About: Fani Yeselia Moreno Lopez is an inspiration to us all! She is a third generation coffee farmer and mothe",en
Producer:,en
"Nectarine, kiwifruit, creamy, & silky Producer: Manuel Vallecillo Region: El Cielito Varietal: Pacas Process: Washed Relationship: Since 2014 Recipe: Espresso - 1:2",en
"Resistant to Roya (plant fungus) Tasting Notes Cacao, milk chocolate, raspberry (black forest cake) ﻿Process Washed",en
"﻿Peach, pineapple, tangy apricot, green apple and tea-like The Story Behind the Bean: Absolute gold! We first heard of this coffee when Nolan travelled to Guatemala in 2016",en
"﻿Zesty lemon, raspberry, tangy apricot and green apple The Story Behind th e Bean: Finca Santa Isabel is currently directed by Luis (Wicho) Valdes",en
﻿,en
"﻿ ﻿Floral, blackberry, sparkling, milk chocolate and clean The Story Behind the Bean: This is a coffee you should know relatively well if you have been drinking Nahun Fernandez the past few years! Thi",en
"It is floral, vibrant, and packed with loads of blackberry",en
"This is a perfect example of a juicy, clean, and tasty coffee from the Santa Barbara region",en
"It's a big ol' fruit bomb! Strawberry, cherry, blackcurrant, with a juicy, syrupy body Composed of a washed Colombia, and a naturally processed Geisha from Panama, Exploding Heart is a coffee everyone",en
"5 Filter - 1:17 Region Bensa District, Sidama Varietal Mikicho + Setami + mixed indigenour heirloom varietals Farmer Assesfa Dukama Tasting Notes Plummy red fruits, all spice and syrupy raspberry fruit leather ﻿Process Sun Dried Natural, dried on raised beds",en
"Cola, grapefruit, & candied orange Region: Guji Varietal: Heirloom Process: Washed Recipes: Espresso: 1:2",en
"Cherry, currant, cola, & honey Region: Agaro Varietal: Ethiopia Landraces Process: Washed Recipes: Espresso: 1:2",en
"Candied ginger, raspberry, & strawberry Region: Jimma Varietal: Ethiopia Landraces Process: Washed Recipes: Espresso: 1:2",en
"Strawberry, ripe cherries, silky & creamy body Region: Yirgacheffee, Gedeo Varietal: Ethiopian Heirloom Process: Natural Altitude: 1750-1950 masl Recipes: Espresso: 1:2",en
"Fruit, plums, cherries, chocolate and strawberries, silky body & apricot acidity Recipes : Espresso: 1:2",en
"Tasting Notes: Fruit, plums, cherries, chocolate and strawberries, silky body & apricot acidity Recipes : Espresso: 1:2",en
"Floral, bright & juicy, sparkling apricot acidity Recipes :  Espresso: 1:2",en
"Tasting Notes: Floral, bright & juicy, sparkling apricot acidity Recipes :  Espresso: 1:2",en
"Exotic AF, jammy AF, plums, & winey Farm: Elida Estate Producer: Wilford Lamastus Varietal: Green Tip Geisha Process: Anaerobic Slow Dry Natural Relationship Since: 2016 About: Elida Estate from Lamas",en
"Jasmine, dancing acidity, vanilla, & apricot Farm: Finca Hartmann Producer: Hartmann Family Varietal: Geisha Process: Wa shed Relationship Since: 2011 Ab out: Robert K",en
"Mango, passionfruit, apple blossom Farm: El Burro Producer: Lamastus Family Varietal: Geisha Process: Natural Anaerobic Slow-Dry Relationship: Since 2014 About: Lamastus Family Estates are the Best of",en
"Jasmine, blackberry, winey, & cinnamon Farm: Elida Estate Producer: Lamastus Family Varietal: Geisha Process: Washed Relationship: Since 2014 About: Lamastus Family Estates are the Best of Panama winn",en
jasmine and perfume,en
"Jasmine, mango, chocolate, & green apple Farm: Finca Hartmann Producer: Hartmann Family Varietal: Geisha Process: Natural Relationship: Since 2011 About: This particular parcel of land is called ‘Camp",en
jasmine and floral emanate from the cup,en
"Milk chocolate, peach, & honey Region : Nueva Segovia Process: Natural Producer : Olman Valladarez Varietal : Yellow Catuai Recipe: Espresso - 1:2",en
"Chocolate, rose, melon, peach, lime & jasmine Farm: Hartmann Family Producer: Roberto Brenes Varietal: Geisha Process: Natural Relationship: Since 2011 About: We stood amongst the Lot #1 Geisha plot s",en
"The profile is truly unique; floral, refined, tropical fruits, and lingering aftertaste",en
"Sugary, blackberry, tangy Region: Nueva Segovia Producers: Olman Valladarez Process: Washed Varietal: Caturra Process: Washed Recipe: Espresso - 1:2",en
peach and nectarine,en
"Juicy, tropical fruit, whiskey Region: Ixhuatlán Producers: Petra de Dios Process: Natural Recipe: Espresso - 1:2",en
a fine whiskey,en
"Caramel, chocolate fudge, orange, cantaloupe & creamy body Process: Washed Varietals: Bourbon, Typica, Mundo Novo Region: Oaxaca Recipe: Espresso: 1:2",en
"Melon, tropical, milk chocolate, floral and complex Processing: Natural Anaerobic 48hrs Coffee is left to dry in its whole fruit for 48 hours in a steel tank without oxygen",en
"Orange blossom, honey, pear and juicy",en
"Orange blossom, honey, pear and juicy Region: Dipilto, Nueva Segovia Varietal: Maracaturra A hybrid varietal crossed between Caturra (known for its productivity and balanced flavour) and Maragogipe (a",en
orange blossom and honey jump out of the cup!,en
"Peach, vibrant, apple, cinnamon, & clean",en
"Peach, vibrant, apple, cinnamon, & clean Region: Dipilto, Nueva Segovia Varietal: Maracaturra A hybrid varietal crossed between Caturra (known for its productivity and balanced flavour) and Maragogipe",en
"This creates a vibrant, sweet, and clean cup",en
"Intensely sweet, floral, bomb, tangerine, lemongrass, & cane sugar Farm: Auromar Producer: Roberto Brenes Varietal: Geisha Process: Washed Relationship Since: 2011 About: Auromar ‘Ironman’ Geisha",en
"melon, cherry, and buttercream sweetness",en
"And for fans only, we have a sweet, sweet tee shirt to boot",en
"melon, cherry, and buttercream sweetness",en
"And for fans only, we have a sweet, sweet tee shirt to boot",en
"Nectarine, blackcurrant, passionfruit, cinnamon, vibrant, & tropical fruit Farm: Finca El Carmen Producer: Ivan Morales Varietal: Pacamara Process: Natural Relationship Since: 2020 Ab out: El Carmen f",en
"Jasmine, elegant, raspberry, yuzu, black tea, kiwi, mango, & apricot Farm: Finca San Sebastian Producer: Estuardo Falla Varietal: Geisha Process: Natural Relationship Since: 2020 Ab out: San Sebastian",en
"Jasmine, orange, cinnamon, & honey Farm: Los Bellotos Producer: Pacas Family Varietal: Bernardina Process: Washed Relationship: Since 2012 About: Remember last year when we told you about those five m",en
"melon, cherry, and buttercream sweetness",en
"And for fans only, we have a sweet, sweet tee shirt to boot",en
"Confectionary, milk chocolate, & syrupy Farm: Los Bellotos Producer: Pacas Family Varietal: Bernardina Process: Natural Relationship: Since 2012 About: Remember last year when we told you about those",en
"melon, cherry, and buttercream sweetness",en
"And for fans only, we have a sweet, sweet tee shirt to boot",en
"Floral, peach, strawberry, guava, orange & silky mouthfeel Farm: Fazenda Primavera Producer: Leonardo Montesanto Tavares Varietal: Geisha Process: Anaerobic Nat ural Relationship: Since 2019 Score: 92",en
"This extremely limited lot is gonna go fast, so do yourself a favor and snag a tin now. Frankly, you might want to act fast before we drink it all ourselves. It's just that good!⠀",en
"Cherry, blackberry, red berries, mango, natural wine, & syrupy Farm: Finca El Zafiro Producer: Nancy & Oscar Maca Varietal: Wush Wush Process: Anaerobic Natural About: If there was a coffee on planet",en
"cherry, blackberry, red berries, mango, & natural wine⠀ This extremely limited lot is gonna go fast, so do yourself a favor and snag a tin now",en
"Strawberry liquor, floral, cherry, passionfruit & silky Farm: La Miel Producer: Miguel Botina Varietal: Geisha Process: Natural About: Aerial roots and vines, fit for Tarzan, hung all around us as Mig",en
"ilk chocolate, red berries, tropical, floral, & syrupy",en
"M ilk chocolate, red berries, tropical, floral, & syrupy Farm: Sítio d’Água Limpa Producer: Marianna Junqueira Varietal: Red Catuai Process: Nat ural Relationship: Since 2020 Score: 89",en
"Strawberry, blackcurrant, & passionfruit Region: Kiambu Varietal: SL28 & SL34 Process: Natural Recipes: Espresso: 1:2",en
"Sweet and creamy, nectarine, & raspberry Region: Kiambu Varietal: Ruiru 11 & SL28 Process: Honey Recipes: Espresso: 1:2",en
"Blackcurrant, raisin, & dark chocolate Region: Kiambu Varietal: SL28 & SL34 Process: Washed Recipes: Espresso: 1:2",en
"Chocolate, mango, passionfruit, & silky ﻿ Farm: Finca El Retiro Producer: Pacas Family Varietal: Bernardina Process: Natural Relationship: Since 2012 About: Bernardina is one of the most exciting disc",en
"Apricot, earl grey tea, floral, & citrus ﻿ Farm: Finca La Guachoca Producer: Pacas Family Varietal: Bernardina Process: Washed Relationship: Since 2012 About: Bernardina is one of the most exciting di",en
"jasmine, passionfruit, and earl grey tea",en
"Orange, apricot, mango, & vanilla Farm: Finca La Esperanza Producer: Pacas Family Varietal: Bernardina Process: Double Anaerobic Washed Sunrise Relationship: Since 2012 About: We have worked with the",en
the sunrise over Finca La Esperanza,en
"Orange, rose wine, papaya, & apricot ﻿ Farm: Finca El Retiro Producer: Pacas Family Varietal: Bernardina Process: Anaerobic Honey Sunset Relationship: Since 2012 About: Bernardina is one of the most e",en
the sunsets of Finca El Retiro,en
"Jasmine, mango & pineapple Producer: Hartmann Family Varietal: Geisha Process: Anaerobic Natural Relationship: Since 2015 Region: Finca Ojo de Agua Weight: 100gms About: This tiny lot comes from Finca",en
"Floral, rose tea, silky, tropical fruit & complex acidity Farm: Don Cayito Estate Producer: Luis Ricardo, Calderon Madrigal Varietal: Geisha Process: Washed About: Don Cayito was named in honor of gre",en
"Yellow peach, honey, caramel & cinnamon Farm: La Cumbre Producer: Emilio Lopez Varietal: SL34 Process: Honey Relationship Since: 2010 About: We first met Emilio back in 2010 on our first trip to El Sa",en
"Dark chocolate, blackberry & spice Farm: La Cumbre Producer: Emilio Lopez Varietal: SL28 Process: Natural Relationship Since: 2010 About: We first met Emilio back in 2010 on our first trip to El Salva",en
"Cherry, chocolate, purple grape & complex Farm: La Cumbre Producer: Emilio Lopez Varietal: Orange Bourbon Process: Natural Relationship Since: 2010 About: We first met Emilio back in 2010 on our first",en
"Jasmine, earl grey, milk chocolate, peach & lime Farm: Bambito Estate Producer: Alberto Sitton Rois Region: Boquette Varietal: Geisha Process: Washed Relationship Since: 2012 About: Bambito Estate is",en
"Blackberry, strawberry & intense acidity Region: Embu County Varietals: SL28 & 34, Ruiru 11 & Batian Processing: Washed Recipe: Espresso: 1:2",en
"﻿Strawberry, pineapple, grapefruit and dark chocolate Region: Kirinyaga District, Central Province Varietals: SL28 & 34, Ruiru 11 ﻿Processing: Washed Process, Sun-dried Altitude: 1,600-1,700 masl ﻿Rec",en
"Bright citrus acidity, currant, berries & caramel Region: Kirinyaga Varietals: SL28, Ruiri 11 & SL34 Processing: Fully Washed & Sundried Cherry is pulped, fermented and washed removing all the sticky",en
"This creates a vibrant, sweet, and clean cup",en
"Region El Cedral (1730 masl) Varietal Mixed, Pacas and Catimor Tasting Notes Milk chocolate, blackberry, nectarine and apricot ﻿Process Washed",en
"This creates a vibrant, sweet and clean cup",en
Producer:,en
"Pink grapefruit, red currant, & floral Producer: Ovidio Gomez Region: Finca El Paraiso Varietal: Parainema Process: Washed Relationship: Since 2012 Recipe: Espresso - 1:2",en
grapefruit and white florals,en
Producer:,en
"Peach, apricot, & creamy Producer: Nahun Fernandez Region: Las Flores Varietal: Yellow Catuai Process: Anaerobic Honey Relationship: Since 2012 Recipe: Espresso - 1:2",en
yellow stone fruit like peach and apricot,en
Producer:,en
"Dark chocolate, grilled pineapple, honey, & hibiscus Producer: Nahun Fernandez Region: Las Flores Varietal: Parainema Process: Natural Relationship: Since 2012 Recipe: Espresso - 1:2",en
Producer:,en
"Peach, tangy, vanilla, & floral Producer: Nahun Fernandez Region: Las Flores Varietal: Parainema Process: Honey Relationship: Since 2012 Recipe: Espresso - 1:2",en
﻿,en
"﻿ ﻿ Chocolate fudge, pear, white nectarine and malt",en
"Lime, strawberry, & cola Region: Guji Varietal: Wolisho Process: Natural Recipes: Espresso: 1:2",en
"Juicy red fruits, clean & bright Region: Oromia District: Hambela Wamena Varietal: Mixed Heirloom Process: Washed Recipes: Espresso: 1:2",en
"Juicy strawberry, pear, & watermelon Region: Oromia, East Guji District: Odo Shakiso Woreda Varietal: Heirloom Process: Natural Recipes: Espresso: 1:2",en
"Juicy ripe peaches, raspberry, lemonade & melon Region: Buku, Oromia, Guji District: Hambela Wamena Varietal: Heirloom Process: Natural Recipes: Espresso: 1:2",en
"Peach, cherry, & winey Producer: Silva Family Varietal: Bourbon Process: Anaerobic Hone y Relationship Since: 2015 Recipes: Espresso: 1:2",en
"Cherry, red wine, & milk chocolate Relationship: Since 2012 Region : Santa Ana Process: Natural Producer : Pacas Family Farm: Finca San Joaquin Varietal : Red Bourbon Recipe: Espresso - 1:2",en
"cherry, red wine, milk chocolate with a big syrupy body",en
"Through this process, we get delicious notes of cherry, red wine, milk chocolate with a big syrupy body",en
"Honey, caramel and milk chocolate Relationship: Since 2015 Region : Ahuachapan Process: Natural Producer : Silva Family Farm: Entre Cerros Varietal : Bourbon Recipe: Espresso - 1:2",en
"Milk chocolate, stewed apple, & peanut butter Region: Santa Ana Producers: Maria Pacas Process: Washed Recipe: Espresso - 1:2",en
"Peach, blackberry, cinnamon, cocoa and syrupy Region: Apaneca Ahuachapan Varietals: Pacamara A dwarf varietal known for very good cup quality and yields",en
"Honeydew melon, peach, maple syrup and juicy Region: Apaneca, Ahuachapan Varietals: Yellow Caturra Caturra is a dwarf varietal known for good cup quality and yields",en
"Rose, peach, watermelon and silky Region: Apaneca, Ahuachapan Varietals: Bourbon A tall varietal known for very good cup quality and medium yields",en
"Green apple, green grape, apricot, caramel, and super creamy Producer: Cafe Pacas, Vivagua Mill, El Salvador Region: Canton Lomas De San Marcelino Varietal: Red Bourbon Processing: Washed - Cherry is",en
"This coffee is extremely sweet, balanced and clean, with a nice acidity that makes it ideal for espresso and filter",en
About: Finca San Joaquin is a part of the reputable collection of farms from the Pacas family in El Salvador,en
"Jammy, white peach, guava, cinnamon, caramel, & creamy mouthfeel Welcome to Finca La Siberia",en
"Raisin, date, caramel, orange and maple syrup Black & Milk/Cream: This coffee is roasted on the darker side, so it's great for drip coffee, french press and is well suited to milk or cream",en
"Floral, honey, peach, apricot, & caramel About: Welcome to Finca La Siberia",en
"Chocolate, vanilla, melon, & hibiscus",en
"Chocolate, vanilla, melon, & hibiscus Producer: Nahun Fernandez Region: Los Flores, Santa Barbara Varietal: Pacas & Catuai Process: Anaerobic Natural 60hr Relationship: Since 2012 Recipe: Espresso - 1",en
"This process creates a syrupy mouthfeel, and extra deep and complex flavors",en
"Tropical fruits, jam, & milk chocolate Region: Nueva Segovia Producers: Olman Valladarez Process: Anaerobic Natural 60hrs Recipe: Espresso - 1:2",en
"Plum, grape, 100% purple Region: Nueva Segovia Producers: Olman Valladarez Process: Anaerobic Natural 72hr Recipe: Espresso - 1:2",en
"Cinnamon, red apple, & hot cross buns Region: Tarrazú Producers: Luis Eduardo Campos Varietal: Caturra Process: Anaerobic Recipe: Espresso - 1:2",en
"Grilled peach, mango, papaya, passionfruit, & cola Region: Kayanza Varietal: Red Bourbon Process: Natural Recipes: Espresso: 1:2",en
"Pineapple, papaya & bubblegum Region: Carmo de Minas Producers: Luiz Paulo Dias Pereira Process: Natural Recipe: Espresso - 1:2",en
"Cinnamon, candy sweet & shortbread Region: Carmo de Minas Producers: Jesimar Sandi Process: Natural Recipe: Espresso - 1:2",en
