note,lang
"Uniformity, Clean Cup, Sweetness, and Defects",en
"Although the boxes for “Uniformity,” “Clean Cup,” “Sweetness,” and “Defects” sit towards the end (or right) of the cupping form, several respondents suggested this section should be moved to the front (or left) of the form, as it is often the first evaluation marked",en
) The same problem exists with other contaminations because the definition of both “clean cup” and “defects” have taken different interpretations through time,en
"Many suggested an “obvious” solution, to replace sweetness evaluation as a presence (descriptive) to a quality assessment (quality scale), with or without an intensity scale included as reference of the evaluator",en
"Any evolution of the cupping system will need to rethink the presence and evaluation of sweetness, bearing in mind that any change to this important yet complicated section stands to impact the livelihoods of coffee producers",en
From “Body” to “Mouthfeel”,en
"The word “body” as a descriptor of categorical evaluation causes issues for some users, likely in some cultural contexts",en
Most interviewees from Europe or Asia held strong opinions that a more accurate word for this evaluation is “mouthfeel,en
"If the definition and protocol is improved, mouthfeel could include “astringency” which would in turn, provide an approach for respondents who requested that this attribute be considered (however this needs to be analyzed further)",en
"Other alternatives such as viscosity, tactile evaluation, or others could be applicable as well",en
"Finally, while some indicated the form is very thorough and with that, complex, others said it would actually benefit from including some flavor modulation components",en
"Of these, some suggested the same exact type of scale, while others suggested a type of interactive scale linking the fermentation balance to the taste balance",en
"” For others, the type of interactive scales as seen in the robusta form (“Bitter-Sweet” ratio and “Salt-Acid” ratio) could be incorporated",en
"Other alternatives such as viscosity, tactile evaluation, or others could be applicable as well.",en
"Of these, some suggested the same exact type of scale, while others suggested a type of interactive scale linking the fermentation balance to the taste balance",en
"Beginning with sample identification and initial assessment, respondents identified that green grading, quakers, water activity, and the inclusion of a roast protocol are required",en
"This desire to evolve the protocol also extended to the cupping procedure itself, particularly the number of cups used",en
"Building on the findings of the literature review and perception study, the research team has proposed a vision to evolve the existing cupping system into its next phase as a coffee value assessment system",en
"” For others, the type of interactive scales as seen in the robusta form (“Bitter-Sweet” ratio and “Salt-Acid” ratio) could be incorporated",en
"Building on the findings of the literature review and perception study, the research team has proposed a vision to evolve the existing cupping system into its next phase as a coffee value assessment system",en
"The previous cycle of the SCA cupping system was based on the existing definition of specialty coffee at the time of creation, namely the “Specialty Grade” standard for washed green arabica coffee",en
"Although the SCA Cupping Protocol and various other standards and tools remain in effect, the Specialty Grade specifications are no longer easily found on the SCA’s website nor in its publications, save for the Arabica Green Coffee Defect Guide",en
"If we want the SCA’s cupping system to help actors discover a coffee’s quality, attributes, or value, we first needed to begin by defining how these concepts are understood in today’s specialty coffee industry",en
"We propose a revision of the SCA Coffee Value Assessment system, building on this new foundation of attribute-based value discovery in specialty coffee, with three objectives: enhanced usefulness for the community, congruency with sensory science, and transparency about how a coffee’s attribute compare with the buyer’s needs",en
ency about how a coffee’s attribute compare with the buyer’s needs,en
"Though the World Coffee Research (WCR) Sensory Lexicon, the this would not be classic descriptive analysis: the analysis could be broken by tasting step (fragrance, aroma, flavor, aftertaste, mouthfeel, etc",en
"Intensities could be grouped by step, as they are now (fragrance intensity, aroma intensity) or broken down by attribute (e",en
", sour and salty tastes as part of the flavor “step”)",en
"Since it is not possible to rate the intensity of all WCR Sensory Lexicon attributes, the main categories of the SCA’s Flavor Wheel (Floral, Fruity, Sour/Fermented, Green/Vegetative, Other, Roasted, Spices, Nutty/Cocoa and Sweet) could be rated by intensity or just marked when present, as in a check-all-that-apply (CATA) test",en
"Cup quality assessment is the part most resembling our current cupping method, and some essential features should be retained: a final score will be produced by adding up the scores of the different cupping “categories” or steps, which are rated separately, though this does not mean we will keep the same rating scales or even the same categories we currently have",en
"These may include all types of information about a coffee’s history, including relevant traceability, origin, processing, and sustainability information",en
"These may include all types of information about a coffee’s history, including relevant traceability, origin, processing, and sustainability information",en
it requires working with partners and executing multiple projects to research and design iterations of the different components of the SCA’s cupping system,en
"- Change “Body” to “Mouthfeel,” which includes “Astringency” as a part of the definition",en
"- Re-write the SCA Cupping Protocol, tailoring for clarification, industry standards, better definitions, etc",en
"Change “Body” to “Mouthfeel,” which includes “Astringency” as a part of the definition",en
"Re-write the SCA Cupping Protocol, tailoring for clarification, industry standards, better definitions, etc.",en
"- Change “Body” to “Mouthfeel,” which includes “Astringency” as a part of the definition",en
"- Re-write the SCA Cupping Protocol, tailoring for clarification, industry standards, better definitions, etc",en
- Develop a “perception of sweetness in coffee” research project to determine course of action for the “sweetness” attribute,en
- More vertical scales to expand the descriptive element of the cupping form,en
"Everyone manages change differently, and we know we need to tread extra carefully with something as far-reaching and globally understood as cupping",en
"In addition, as cupping is a sensorial activity—and coffee’s sensory attributes are an important factor in determining a coffee’s value—any evolution will also need to factor in the advancements in sensory science to create a robust tool",en
"Just as the original cupping protocol was based on a definition of specialty coffee, specifically the specialty grade standard for washed green arabica coffee, the evolved cupping system will need to be based on a definition, too",en
"Change “Body” to “Mouthfeel,” which includes “Astringency” as a part of the definition",en
"Re-write the SCA Cupping Protocol, tailoring for clarification, industry standards, better definitions, etc.",en
Develop a “perception of sweetness in coffee” research project to determine course of action for the “sweetness” attribute,en
More vertical scales to expand the descriptive element of the cupping form,en
"Everyone manages change differently, and we know we need to tread extra carefully with something as far-reaching and globally understood as cupping.",en
"ca coffee, the evolved cupping system will need to be based on a definition, too",en
"At the time of writing, in addition to initial alpha-tests run in collaboration with World Coffee Research to understand how cuppers actually use the current protocol when buying and scoring coffees in the real world, the SCA has since completed its first round of initial beta-tests of the descriptive and affective cupping sections with an initial group of coffee producers and exporters",en
3 Cupping Sections,en
1 Olfactory Lexicon,en
3 Mouthfeel Lexicon,en
2 Rating Intensity,en
1 Olfactory Category Examples,en
4.3 Cupping Sections,en
5.1 Olfactory Lexicon,en
5.3 Mouthfeel Lexicon,en
6.2 Rating Intensity,en
8.1 Olfactory Category Examples,en
"Instead of quantifying the intensity of specific sensory attributes, such as ""chocolate"" or ""fruity,"" the total intensity of each cupping section is rated, i",en
"Their output can be correlated with other layers of information, such as impression of quality, or specific factors or variables related to production or processing",en
The sensory assessment used in the Coffee Value Assessment system combines intensity ratings and check-all-that-apply (CATA) descriptions,en
", the total fragrance intensity",en
"[^1]: See *Coffee Sensory and Cupping Handbook* (2021), chapter 14",en
- SCA Cupping Protocol (2004),en
"For the assessment of brewed coffee products, the fragrance section should be omitted",en
"[^1]: See *Coffee Sensory and Cupping Handbook* (2021), chapter 14.",en
SCA Cupping Protocol (2004),en
"In coffee, the term ""tasting"" encompasses cupping and other forms of tasting, such as tasting coffee from a batch brew",en
** The perceived strength of a sensory stimulus in a cupping section,en
Intensity does not imply quality or desirability,en
"For example, fragrance intensity is the perceived strength of the odor of the dry coffee grounds, as a single perception",en
"The human olfactory system consists of the nose, the nasal cavities, and the olfactory bulb in the brain, which processes information from the olfactory receptors lining the nasal cavities",en
"** One of two entryways of odor molecules into the human olfactory epithelium, the orthonasal passageway is through the nose, as we breathe in, and is how we pick up the odor from the environment",en
"** One of two entryways of odor molecules into the human olfactory epithelium, the retronasal passageway is from the back of the mouth cavity, as we breathe out, and is how we pick up the olfactory component of flavor",en
"In this case, it refers to the ""mouthfeel"" or tactile sensations within the mouth in response to the coffee stimulus: thickness (viscosity), texture, pungency, etc",en
The purpose of a cupping may be to do a descriptive assessment or an affective assessment,en
The purpose of a cupping may be to do a descriptive assessment or an affective assessment,en
"For the purpose of the CVA Descriptive Assessment, each descriptor in the inner or middle circle of the Flavor Wheel also represents a ""flavor category"" that encompasses descriptors in the outer circle of the wheel",en
"** Referring to the sense of taste, just as ""visual"" refers to the sense of sight and ""olfactory"" to the sense of smell",en
3 Cupping Sections,en
Cupping sections are aspects of the coffee tasting experience,en
** The orthonasal olfactory perception of the coffee grounds prior to brewing (i,en
"** The orthonasal olfactory perception of the coffee brew, assessed at two moments: right after brewing and while the crust is broken (i",en
"** The perception coming from both the taste of the brew and the brew's retronasal olfactory component, while the brew is in the mouth",en
"** The perception coming from both the taste and the retronasal olfactory component caused by the remnants of the brew inside the mouth and throat, after the brew has been ejected or swallowed",en
"** The perception of sour taste provoked by the brew, which may vary in intensity and character",en
** The perception of gustatory or retronasal sweetness provoked by the brew,en
"** The tactile perception of the brew while it is in the mouth, excluding the temperature perception",en
"It encompasses the brew's thickness (viscosity), its texture, and other tactile properties such as astringency (mouth-drying property)",en
Additional freely elicited descriptors may be used by tasters at the different cupping sections to further specify or nuance their perceptions,en
1 Olfactory Lexicon,en
4.3 Cupping Sections,en
"Fragrance.** The orthonasal olfactory perception of the coffee grounds prior to brewing (i.e., the smell of the coffee grounds).",en
"Aroma.** The orthonasal olfactory perception of the coffee brew, assessed at two moments: right after brewing and while the crust is broken (i.e., the smell of the brew).",en
"Acidity.** The perception of sour taste provoked by the brew, which may vary in intensity and character.",en
Sweetness.** The perception of gustatory or retronasal sweetness provoked by the brew.,en
5.1 Olfactory Lexicon,en
"- **Smooth (Velvety, Silky, Syrupy)",en
"encompasses the brew's thickness (viscosity), its texture, and other tactile properties such as astringency (mouth-drying property)",en
Additional freely elicited descriptors may be used by tasters at the different cupping sections to further specify or nuance their perceptions,en
1 Olfactory Lexicon,en
"The descriptive assessment includes a number of descriptive terms for olfactory-driven flavors in coffee, which are collectively referred to as the ""olfactory lexicon",en
""" These are frequently used terms, representing descriptors that are often found on cupping sheets",en
Each olfactory lexicon term has a number of sensory examples that serve to help define the sensory term and increase communication among cupping professionals (see Appendix 8,en
"Each olfactory lexicon term may also represent a ""category"" of flavors",en
"For example, while ""citrus fruit"" may be used as its own descriptive term, it might also encompass other flavors such as lemon, lime, orange, and grapefruit (which all appear on the complete Coffee Taster's Flavor Wheel)",en
"However, both ""sour"" and ""sweet"" can also be used as descriptors for olfactory sensations",en
3 for sensory examples of these terms when they represent olfactory sensations,en
3 Mouthfeel Lexicon,en
"The term ""mouthfeel"" represents the brew's thickness (viscosity) in the mouth and its texture, and other tactile sensations such as astringency and ""metallic feel",en
"This texture can also be exemplified by that of butter or cream, from the mouthfeel point of view",en
** An aromatic and mouthfeel associated with tin cans or aluminum foil,en
"encompasses the brew's thickness (viscosity), its texture, and other tactile properties such as astringency (mouth-drying property).",en
5.1 Olfactory Lexicon,en
Salty.** 0.20% sodium chloride solution (use refined table salt).,en
Sour (gustative).**[^2] 0.04% citric acid solution.,en
Sweet (gustative).**[^2] 0.52% sucrose solution (use white sugar or refined sugar).,en
Bitter.** Dark roasted coffee (about Agtron 35).,en
5.3 Mouthfeel Lexicon,en
"The term ""mouthfeel"" represents the brew's thickness (viscosity) in the mouth and its texture, and other tactile sensations such as astringency and ""metallic feel.""",en
"Smooth (Velvety, Silky, Syrupy).** A smooth texture in the mouth, exemplified by a syrup.",en
Metallic.** An aromatic and mouthfeel associated with tin cans or aluminum foil. Exemplified by potassium chloride solution (see *WCR Sensory Lexicon*).,en
"As an example, if a coffee's fragrance has a strong fruity note and a subtle chocolate note, the taster would not rate the individual intensity of each characteristic, but the combined (total) intensity of the fragrance, no matter its blend of components",en
** An aromatic and mouthfeel associated with tin cans or aluminum foil,en
"Once the sample is ready to be assessed, and before starting the tasting, the roast level of the sample shall be estimated visually, when applicable, and recorded",en
"Next, in the first step of the assessment, fragrance shall be assessed and its intensity rated",en
the characteristics found in the fragrance shall be marked in the CATA section for orthonasal characteristics (below the fragrance and aroma intensity scales),en
"In the second step, the coffee shall be brewed, aroma assessed, and its intensity rated",en
the characteristics found in the aroma shall also be marked in the same CATA section for orthonasal characteristics,en
"The intensity of flavor and aftertaste shall be rated, and their characteristics checked in a CATA list that accounts for both flavor and aftertaste",en
"The acidity intensity shall be rated, and its characteristics described through freely elicited terms",en
"The same shall be done for sweetness, while mouthfeel shall be rated in intensity, and its characteristics checked in the mouthfeel CATA list",en
2 Rating Intensity,en
The intensity of cupping sections shall be rated using 15-point scales (see Figure 1),en
"As they progress through the cupping sections, tasters shall assess the total intensity of each section using the 15-point scale",en
"Intensity scale for ""fragrance"" on the descriptive assessment form",en
"[Intensity scale: a 15-point horizontal scale labeled LOW (0-5), MEDIUM (5-10), HIGH (10-15), used for rating Fragrance Intensity]",en
"Tasters may place a tick anywhere along the intensity scale, even in between integer numbers",en
"If, for whatever reason, a taster changes their mind regarding a section's intensity before th",en
"py).** A smooth texture in the mouth, exemplified by a syrup.",en
Metallic.** An aromatic and mouthfeel associated with tin cans or aluminum foil. Exemplified by potassium chloride solution (see *WCR Sensory Lexicon*).,en
"a. Once the sample is ready to be assessed, and before starting the tasting, the roast level of the sample shall be estimated visually, when applicable, and recorded.",en
6.2 Rating Intensity,en
"Figure 1. Intensity scale for ""fragrance"" on the descriptive assessment form.**",en
"Intensity scale for ""fragrance"" on the descriptive assessment form",en
"[Intensity scale: a 15-point horizontal scale labeled LOW (0-5), MEDIUM (5-10), HIGH (10-15), used for rating Fragrance Intensity]",en
"Tasters may place a tick anywhere along the intensity scale, even in between integer numbers",en
"If, for whatever reason, a taster changes their mind regarding a section's intensity before the cupping is over, they shall add a second mark and show the direction of change with an arrow above the scale",en
"The descriptive characteristics of the coffee shall be recorded using CATA lists for each of the three boxes in the form with CATA lists in them: fragrance and aroma, flavor and aftertaste, and mouthfeel",en
"In the case of acidity and sweetness, assessors should record their own descriptors for those sections, even though they do not include a CATA list",en
1 Fragrance and Aroma Box,en
This box is located below the intensity scales for fragrance and aroma,en
It includes a single list meant to encompass both orthonasal sections (fragrance and aroma),en
"Up to five descriptors that best represent the coffee should be selected in this list, encompassing both fragrance and aroma",en
2 Flavor and Aftertaste Box,en
"One is for retronasal perceptions, and the other is for gustatory perceptions",en
"As the retronasal list (on the left-hand side) refers to the olfactory dimension of coffee, the descriptors used are the same as for the fragrance and aroma CATA list, and the way to use it is the same as 6",en
"On the main tastes list, on the right-hand side, the taster shall record up to two main tastes that best represent the coffee from both the flavor and aftertaste sections",en
"Portion of the ""Flavor"" and ""Aftertaste"" category section on the descriptive assessment form",en
CATA boxes for retronasal perceptions are on the left and gustatory perception (Main Tastes) on the right,en
- Flavor Intensity and Aftertaste Intensity: each with a 15-point scale (LOW / MEDIUM / HIGH),en
"- Retronasal CATA checkboxes (left side): Floral, Fruity, Berry, Dried Fruit, Citrus Fruit, Roasted, Cereal, Burnt, Tobacco, Sour/Fermented, Sour, Fermented, Nutty/Cocoa, Nutty, Cocoa, Green/Vegetative, Spice, Other, Chemical, Musty/Earthy, Woody, Sweet, Vanilla/Vanillin, Brown Sugar",en
3 Mouthfeel Box,en
"- Main Tastes (2) checkboxes (right side): Salty, Bitter, Sour, Umami, Sweet]",en
"Figure 1. Intensity scale for ""fragrance"" on the descriptive assessment form.**",en
6.3.1 Fragrance and Aroma Box,en
6.3.2 Flavor and Aftertaste Box,en
Flavor Intensity and Aftertaste Intensity: each with a 15-point scale (LOW / MEDIUM / HIGH),en
"Main Tastes (2) checkboxes (right side): Salty, Bitter, Sour, Umami, Sweet]",en
6.3.3 Mouthfeel Box,en
"As an example, if a conspicuous blueberry flavor is found, the taster should mark ""berry"" (as well as ""fruity"") and write down ""blueberry"" in the flavor and aftertaste box",en
"- Retronasal CATA checkboxes (left side): Floral, Fruity, Berry, Dried Fruit, Citrus Fruit, Roasted, Cereal, Burnt, Tobacco, Sour/Fermented, Sour, Fermented, Nutty/Cocoa, Nutty, Cocoa, Green/Vegetative, Spice, Other, Chemical, Musty/Earthy, Woody, Sweet, Vanilla/Vanillin, Brown Sugar",en
3 Mouthfeel Box,en
"Note these options describe the mouthfeel quality, as its intensity (in the form of body level or thickness) has been rated on the corresponding scale",en
"All the descriptive sections, including acidity and sweetness, allow tasters to write down freely elicited descriptors",en
There are three situations when a written descriptor should be used:,en
", in acidity and sweetness)",en
- When there is a very precise descriptor for the category box marked,en
"Here, the descriptor expands the meaning of the selected descriptor",en
"As an example, if a rare, dried tomato note is found, the taster should write ""dried tomato"" in the relevant cupping section",en
"The use of a cupping app or cupping platform, specifically designed for the Coffee Value Assessment data structure, is recommended",en
"In cases where the use of a digital CVA cupping platform is not practical or is unavailable, tasters should use the form in 8",en
1 Olfactory Category Examples,en
"field, ROAST LEVEL field",en
**Fragrance and Aroma section:**,en
"- Fragrance Intensity: 15-point scale (LOW / MEDIUM / HIGH), Notes field",en
- Aroma Intensity: 15-point scale (LOW / MEDIUM / HIGH),en
"- CATA checkboxes (orthonasal): Floral, Fruity, Berry, Dried Fruit, Citrus Fruit, Roasted, Cereal, Burnt, Tobacco, Sour/Fermented, Sour, Fermented, Nutty/Cocoa, Nutty, Cocoa",en
"- Main Tastes (2) checkboxes (right side): Salty, Bitter, Sour, Umami, Sweet]",en
"Main Tastes (2) checkboxes (right side): Salty, Bitter, Sour, Umami, Sweet]",en
6.3.3 Mouthfeel Box,en
"All the descriptive sections, including acidity and sweetness, allow tasters to write down freely elicited descriptors. There are three situations when a written descriptor should be used:",en
"When there are no CATA boxes to check (i.e., in acidity and sweetness).",en
"When there is a clear note that does not belong to any category. As an example, if a rare, dried tomato note is found, the taster should write ""dried tomato"" in the relevant cupping section.",en
8.1 Olfactory Category Examples,en
"Header:** SAMPLE NO. field, ROAST LEVEL field",en
Fragrance and Aroma section:**,en
"Fragrance Intensity: 15-point scale (LOW / MEDIUM / HIGH), Notes field",en
Aroma Intensity: 15-point scale (LOW / MEDIUM / HIGH),en
"CATA checkboxes (orthonasal): Floral, Fruity, Berry, Dried Fruit, Citrus Fruit, Roasted, Cereal, Burnt, Tobacco, Sour/Fermented, Sour, Fermented, Nutty/Cocoa, Nutty, Cocoa",en
"field, ROAST LEVEL field",en
**Fragrance and Aroma section:**,en
"- Fragrance Intensity: 15-point scale (LOW / MEDIUM / HIGH), Notes field",en
- Aroma Intensity: 15-point scale (LOW / MEDIUM / HIGH),en
"- CATA checkboxes (orthonasal): Floral, Fruity, Berry, Dried Fruit, Citrus Fruit, Roasted, Cereal, Burnt, Tobacco, Sour/Fermented, Sour, Fermented, Nutty/Cocoa, Nutty, Cocoa, Green/Vegetative, Spice, Other, Chemical, Musty/Earthy, Woody, Sweet, Vanilla/Vanillin, Brown Sugar",en
**Flavor and Aftertaste section:**,en
"- Flavor Intensity: 15-point scale (LOW / MEDIUM / HIGH), Notes field",en
- Aftertaste Intensity: 15-point scale (LOW / MEDIUM / HIGH),en
**Acidity section:**,en
"- Acidity Intensity: 15-point scale (LOW / MEDIUM / HIGH), Notes field",en
"- Sweetness Intensity: 15-point scale (LOW / MEDIUM / HIGH), Notes field",en
**Mouthfeel section:**,en
"- Mouthfeel Intensity: 15-point scale (LOW / MEDIUM / HIGH), Notes field",en
"The wheel is organized in concentric rings from center outward, with the following top-level categories radiating from the center: Floral, Fruity, Sour/Fermented, Green/Vegetative, Other, Roasted, Spices, Nutty/Cocoa, Sweet",en
"- Main Tastes (2): Salty, Bitter, Sour, Umami, Sweet",en
"- CATA checkboxes: Rough (Gritty, Chalky, Sandy), Smooth (Velvety, Silky, Syrupy), Metallic, Oily, Mouth-Drying",en
"Header:** SAMPLE NO. field, ROAST LEVEL field",en
Fragrance and Aroma section:**,en
"Fragrance Intensity: 15-point scale (LOW / MEDIUM / HIGH), Notes field",en
Aroma Intensity: 15-point scale (LOW / MEDIUM / HIGH),en
Flavor and Aftertaste section:**,en
"Flavor Intensity: 15-point scale (LOW / MEDIUM / HIGH), Notes field",en
Aftertaste Intensity: 15-point scale (LOW / MEDIUM / HIGH),en
"Main Tastes (2): Salty, Bitter, Sour, Umami, Sweet",en
Acidity section:**,en
"Acidity Intensity: 15-point scale (LOW / MEDIUM / HIGH), Notes field",en
"Sweetness Intensity: 15-point scale (LOW / MEDIUM / HIGH), Notes field",en
Mouthfeel section:**,en
"Mouthfeel Intensity: 15-point scale (LOW / MEDIUM / HIGH), Notes field",en
